{
  "name": "9mm Swap OnRamp List",
  "timestamp": "2022-01-26T11:45:09Z",
  "version": {
    "major": 4,
    "minor": 0,
    "patch": 0
  },
  "tags": {},
  "logoURI": "https://pancakeswap.finance/logo.png",
  "keywords": ["pancake", "default"],
  "tokens": [
    {
      "name": "Binance Pegged USDT",
      "symbol": "USDT",
      "address": "0x55d398326f99059fF775485246999027B3197955",
      "chainId": 56,
      "decimals": 18,
      "logoURI": "https://tokens.pancakeswap.finance/images/0x55d398326f99059fF775485246999027B3197955.png"
    },
    {
      "name": "Binance Pegged USD Coin",
      "symbol": "USDC",
      "address": "0x8AC76a51cc950d9822D68b83fE1Ad97B32Cd580d",
      "chainId": 56,
      "decimals": 18,
      "logoURI": "https://tokens.pancakeswap.finance/images/0x8AC76a51cc950d9822D68b83fE1Ad97B32Cd580d.png"
    },
    {
      "name": "USD Coin",
      "address": "0xA0b86991c6218b36c1d19D4a2e9Eb0cE3606eB48",
      "symbol": "USDC",
      "decimals": 6,
      "chainId": 1,
      "logoURI": "https://tokens.pancakeswap.finance/images/symbol/usdc.png"
    },
    {
      "name": "Tether USD",
      "address": "0xdAC17F958D2ee523a2206206994597C13D831ec7",
      "symbol": "USDT",
      "decimals": 6,
      "chainId": 1,
      "logoURI": "https://tokens.pancakeswap.finance/images/symbol/usdt.png"
    },
    {
      "name": "DAI StableCoin",
      "address": "0x6B175474E89094C44Da98b954EedeAC495271d0F",
      "symbol": "DAI",
      "decimals": 18,
      "chainId": 1,
      "logoURI": "https://tokens.pancakeswap.finance/images/symbol/dai.png"
    },
    {
      "name": "Wrapped BTC",
      "symbol": "WBTC",
      "address": "0x2260FAC5E5542a773Aa44fBCfeDf7C193bc2C599",
      "chainId": 1,
      "decimals": 8,
      "logoURI": "https://tokens.pancakeswap.finance/images/eth/0x2260FAC5E5542a773Aa44fBCfeDf7C193bc2C599.png"
    },
    {
      "name": "USD Coin",
      "address": "0xaf88d065e77c8cc2239327c5edb3a432268e5831",
      "symbol": "USDC",
      "decimals": 6,
      "chainId": 42161,
      "logoURI": "https://tokens.pancakeswap.finance/images/symbol/usdc.png"
    },
    {
      "name": "USD Coin",
      "symbol": "USDC",
      "address": "0x176211869cA2b568f2A7D4EE941E073a821EE1ff",
      "chainId": 59144,
      "decimals": 6,
      "logoURI": "https://tokens.pancakeswap.finance/images/symbol/usdc.png"
    },
    {
      "name": "USD Coin",
      "symbol": "USDC",
      "address": "0x833589fCD6eDb6E08f4c7C32D4f71b54bdA02913",
      "chainId": 8453,
      "decimals": 6,
      "logoURI": "https://tokens.pancakeswap.finance/images/polygon-zkevm/0xA8CE8aee21bC2A48a5EF670afCc9274C7bbbC035.png"
    }
  ]
}
